,Song,Artist,artist_trunc,search_term,lyrics_raw
3625,One Call Away,Chingy featuring J-Weav,Chingy featuring,One Call Away Chingy featuring,"[Intro: J-Weav]
Yeah yeah, DTP, how we do, call you, you can call me
Whatever you want to do baby, come on

[Hook: J-Weav, Chingy]
Give me a call if you wanna come roll with me
I'm only one call away
Give me a call if you wanna come roll with me
I'm only one call away
Give me a call if you wanna come roll with me
I'm only one call away
Give me a call if you wanna come roll with me
I'm only one love away

[Verse 1: Chingy]
It was weird how we met, huh
She was with her mom at Bank of America
With my son cashing a check so I asked out of respect, uh
Would she like to explore the world of I we can fly in my jet
Her reply was yes (Can I ask you something?)
I seen it in her eye, Mama looking like all I wanted was sex
Then moved to the next (That ain't true)
But it was something about his girls style that make me feel no regrets
We started off casual walks threw the park
Candle light dinners by dark, I'm thinking smart
Afraid she might think I'm in a rush to touch, clutch and be up
But baby I ain't on that stuff Dropped her off and told her call me up (ring noise)
We could talk, conversate about the lyric subject whatevers starts
So I zoomed off (car noise)
Looking bottom off my phone rang
It was her in the shower (what did she say?)
She said I couldn't do without you Then I say

[Hook: J-Weav, Chingy]
Give me a call if you wanna come roll with me
I'm only one call away
Give me a call if you wanna come roll with me
I'm only one call away
Give me a call if you wanna come roll with me
I'm only one call away
Give me a call if you wanna come roll with me
I'm only one love away

[Verse 2: Chingy]
Yo yo
The next day I'm with the fellas at the case playin ball
Here she come with her friends they posted up on the wall
Now I'm showin off, tryin to dunk, tryin to dribble
Break fast threw the middle just to see her smile and giggle
Game over I approached her with a kiss on the cheek
The homeboys looking at me saying Lil Howard you weak
But you know how that go, what I got they want
What I got I flaunt, never mess with it please don't
Told her I'm goin home she asked can she go too
I'm like yeah boo, I can't see me without you
Got thurr I took a shower, jumped out she in the bed
With a see-through thong on looked at her and I said

[Hook: J-Weav, Chingy]
Give me a call if you wanna come roll with me
I'm only one call away
Give me a call if you wanna come roll with me
I'm only one call away
Give me a call if you wanna come roll with me
I'm only one call away
Give me a call if you wanna come roll with me
I'm only one love away

[Chingy]
Girl recognize game before game recognize you
You dealin with a playa, true, now what you wanna do
We can kick it and go puff on a blunt
Oh you don't smoke? Grab a pint of henn and we can get drunk
Its up to you, I'm the man but baby just let me know
Cause if you got a attitude then I could treat you just like a ho
If ya rollin with me baby hop in its enough room
We can gaze at the stars and shine like the moon
Give me a chance to show ya and a chance to know ya
Just be true and theres nothing I won't do for ya
Some women like to play it foul
But them the kind I put in a place like a child don't worry be happy and smile

[Hook: J-Weav, Chingy]
Give me a call if you wanna come roll with me
I'm only one call away
Give me a call if you wanna come roll with me
I'm only one call away
Give me a call if you wanna come roll with me
I'm only one call away
Give me a call if you wanna come roll with me
I'm only one call away
Give me a call if you wanna come roll with me
I'm only one call away
Give me a call if you wanna come roll with me
I'm only one call away
Give me a call if you wanna come roll with me
I'm only one call away
Give me a call if you wanna come roll with me
I'm only one call away
Give me a call if you wanna come roll with me
I'm only one call away

[Outro: J-Weav]
DTP, ha, how we do, ha, give me call, if you wanna ball, you know what it is"
3626,"Me, Myself and I",Beyonce,Beyonce,"Me, Myself and I Beyonce","[Intro]
All the ladies, if you feel me
Help me sing it out

[Verse 1]
I can't believe I believed
Everything we had would last
So young and naive for me
To think she was from your past
Silly of me to dream
Of one day having your kids
Love is so blind
It feels right when it's wrong

[Verse 2]
I can't believe I fell for your schemes
I'm smarter than that
So dumb and naive to believe
That with me you're a changed man
Foolish of me to compete
When you cheat with loose women
It took me some time
But now I moved on
Because I realized I got

[Chorus]
Me, myself, and I
That's all I got in the end
That's what I found out
And it ain't no need to cry
I took a vow that from now on
I'm gonna be my own best friend
Me, myself, and I
That's all I got in the end
That's what I found out
And it ain't no need to cry
I took a vow that from now on
I'm gonna be my own best friend

[Verse 3]
So controlling, you said
That you love me but you don't
Your family told me
One day I would see it on my own
Next thing I know, I'm dealing
With your three kids in my home
Love is so blind
It feels right when it's wrong

[Verse 4]
Now that it's over
Stop calling me
Come pick up your clothes
Ain't no need to front
Like you're still with me
All your homies know
Even your very best friend
Tried to warn me on the low
It took me some time
But now I am strong
Because I realized I got

[Chorus]
Me, myself, and I
That's all I got in the end
That's what I found out
And it ain't no need to cry
I took a vow that from now on
I'm gonna be my own best friend
Me, myself, and I
That's all I got in the end
That's what I found out
And it ain't no need to cry
I took a vow that from now on
I'm gonna be my own best friend

[Bridge]
(Got me, myself, and I)
I know that I will never disappoint myself
(I must have cried a thousand times)
All the ladies, if you feel me
Help me sing it out
(I can't regret time spent with you)
Yeah, you hurt me
But I learned a lot along the way
(So I have vowed to make it through)
After all the rain
You'll see the sun come out again
(Now I've got me, myself, and I)
Hey
I know that I will never disappoint myself
(I must have cried a thousand times)
I've cried
All the ladies, if you feel me
Help me sing it out
(I can't regret time spent with you)
Hey!
Yeah, you hurt me
But I learned a lot along the way
(So I have vowed to make it through)
After all the rain
You'll see the sun come out again

[Break]
Yea-ea
Oh-oh oh-oh
Oh-oh oh-oh
Oh-oh oh-oh
Oh-oh oh-oh
Oh-oh oh-oh
Oh-oh oh-oh
Oh-oh oh-oh
Whoo-ooh
Whoo-ooh-ooh!

[Bridge 2]
(Now I've got me, myself, and I)
Me, myself, and I
(I must have cried a thousand times)
I have cried so many times
(I can't regret time spent with you)
I can't regret time spent with you
(So I have vowed to make it through)
After all the rain
You'll see the sun come out again
(Now I've got me, myself, and I)
Oh!
I know that I will never disappoint myself
(I must have cried a thousand times)
If you've cried a thousand times
Ladies, you will survive!
(I can't regret time spent with you)
Yeah! You hurt me
But I learned a lot along the way
(So I have vowed to make it through)
I can see the sun shine
I got me, myself, and I"
3627,Turn Me On,Kevin Lyttle,Kevin Lyttle,Turn Me On Kevin Lyttle,"[Intro:]
Oh Yeaaaaaah
Is ah big dance hall song in know
Madzart alongside Kevin Lyttle
You know how it is, you know how we go
You know

[Verse 1: Kevin Lyttle]
For the longest while, we jamming in the party
And you're wining on me
Pushing everything right back on top of me, yeah hah
But if you think you're gonna get away from me
You better change your mind, you're going home
You're going home with me tonight

[Hook: Kevin Lyttle]
Let me hold you, girl, caress my body
You got me going crazy, you
Turn me on, turn me on
Let me jam you, girl wine all around me
You got me going crazy, you
Turn me on, turn me on

[Post-Chorus: Madzart]
Well da gyal ya nah go get 'way tonight
If she think mad man nah go fight
Me done feed her with popcorn and sprite
Waan come fly 'way like kite

[Verse 2: Kevin Lyttle]
One hand on the ground, your bumper cock sky high
Whining hard on me
Got my python hollerin' for mercy, yeah heh
Then I whisper in her ear so whine harder
And then she said to me, ""Boy, just push that thing
Push it harder back on me.""

[Hook: Kevin Lyttle]
So let me hold you, girl, caress my body
You got me going crazy, you
Turn me on, turn me on
Let me jam you, girl wine all around me
You got me going crazy, you
Turn me on, turn me on

[Interlude: Kevin Lyttle] (x2)
Girl just hug me, hug me, kiss me, squeeze me
Hug me, hug me, kiss and caress me
Hug me, hug me, kiss me, squeeze me
Hug me, hug me, kiss and caress me

[Post-Chorus: Madzart]
Well da gyal ya nah go get 'way tonight
If she think mad man nah go fight
Me done feed her with popcorn and sprite
Waan come fly 'way like kite

[Verse 1: Kevin Lyttle]
For the longest while, we jamming in the party
And you're whining on me
Pushing everything right back on top of me, yeah heh
But if you think you're gonna get away from me
You better change your mind, you're going home
You're going home with me tonight

[Hook: Kevin Lyttle]
Let me hold you, girl, caress my body
You got me going crazy, you
Turn me on, turn me on
Let me jam you, girl wine all around me
You got me going crazy, you
Turn me on, turn me on

[Outro: Kevin Lyttle]
Hug me, hug me, kiss me, kiss me
Hug me, hug me, kiss and caress me
Hug me, hug me, squeeze me, squeeze me
Hug me, girl, kiss and caress me"
3628,The First Cut Is the Deepest,Sheryl Crow,Sheryl Crow,The First Cut Is the Deepest Sheryl Crow,"[Verse 1]
I would have given you all of my heart
But there's someone who's torn it apart
And he's taken just all that I have
But if you want I'll try to love again
Baby, I'll try to love again, but I know

[Chorus]
The first cut is the deepest
Baby I know
The first cut is the deepest
But when it comes to being lucky, he's cursed
When it comes to lovin' me, he's worst

[Verse 2]
I still want you by my side
Just to help me dry the tears that I've cried
And I'm sure gonna give you a try
If you want I'll try to love again, (try)
Baby, I'll try to love again, but I know

[Chorus]
The first cut is the deepest
Baby I know
The first cut is the deepest
But when it comes to being lucky, he's cursed
When it comes to lovin' me, he's worst

[Bridge]
I still want you by my side
Just to help me dry the tears that I've cried
But I'm sure gonna give you a try
Cuz if you want I'll try to love again
(Try to love again, try to love again)
Baby, I'll try to love again but I know, Ohhhh

[Chorus]
The first cut is the deepest
Baby I know
The first cut is the deepest
When it comes to bein' lucky, he's cursed
When it comes to lovin' me, he's worst

[Outro]
Ohhhh, the first cut is the deepest
Baby I know (baby I know)
The first cut is the deepest
Try to love again"
3629,You Don't Know My Name,Alicia Keys,Alicia Keys,You Don't Know My Name Alicia Keys,"[Verse 1]
Baby, baby, baby
From the day I saw you
I really really want to catch your eye
There's something special 'bout you
I must really like you
Not a lotta guys are worth my time
Ooo baby, baby, baby
It's gettin kind of crazy
Cause you are takin over my mind

[Chorus]
And it feels like oooooo
But you don't know my name
And I swear it feels like ooooo ooooo ooooo ooooo
You don't know my name
(round and round and round we go, will you ever know)

[Verse 2]
Oh baby baby baby
I see us on our first date
You're doin everything that makes me smile
And when we had our first kiss
It happened on a Thursday
Ooooo it set my soul on fire
Ooo baby baby baby
I can't wait for the first time
My imagination's runnin wild

[Chorus]
It feels like ooooo
You don't know my name
And I swear it baby, it feels like oooo ooooo ooooo ooooo
You don't know my name
(round and round and round we go, will you ever know)

[Bridge]
""I'm sayin, he don't even know what he's doin' to me
Got me feelin' all crazy inside
I'm feelin like""
Owww! Ooooo Oooooo
Doin more than I've ever done for anyone's attention
Take notice of what's in front of you
Cause did I mention you're 'bout to miss a good thing
And you'll never know how good it feels to have all of my affection
And you'll never get a chance to experience my lovin'
Cause...

[Chorus]
My lovin' feels like ooooooo
You don't know my name
(round and round and round we go, will you ever know)
And I swear it feels like oooo ooooo ooooo ooooo
You don't know my name
(round and round and round we go, will you ever know)
Ohhh

Will you ever know it, no no no no no
Will you ever know it?

[Alicia talking on the phone (choirs)]
""I'm gonna have to just go ahead and call this boy
Hello? Can I speak to -- to Michael?
Oh hey, how you doin?
Uh, I feel kinda silly doin' this
But um, this is the waitress from the coffee house on 39th and Lennox
You know, the one with the braids?
Yeah, well I see you on Wednesdays all the time
You come in every Wednesday on your lunch break, I think
And you always order the special, with the hot chocolate
And my manager be tripping and stuff
Talking bout we gotta use water
But I always use some milk and cream for you
Cause I think you're kinda sweet
Anyway you always got on some fly blue suit
'n your cuff links are shining all bright
So, whatchu do? Oh, word? Yeah, that's interesting
Look man, I mean I don't wanna waste your time but
I know girls don't usually do this
But I was wondering if maybe we could get together
Outside the restaurant one day
Cause I do look a lot different outside my work clothes
I mean we could just go across the street to the park right here
Wait, hold up, my cell phone's breakin up, hold up
Can you hear me now? Yeah
So, what day did you say?
Oh yeah, Thursday's perfect, man:.""

[Chorus]
And it feels like oooo
You don't know my name
(round and round and round we go, will you ever know)
Baby Baby I swear it's like oooooo
You don't know my name, no no no
(round and round and round we go, will you ever know)
And it feels like oooo
You don't know my name
(round and round and round we go, will you ever know)

[Outro]
And I swear on my mother and father it feels like
Oooo ooo oooo ooo ooo ooo
Oooo ooo oooo ooo ooo ooo
Oooo ooo oooo ooo ooo ooo
You don't know my name
(round and round and round we go, will you ever know?)"
3630,My Place,Nelly featuring Jaheim,Nelly featuring,My Place Nelly featuring,"[Jaheim ad-libs]

[Verse 1 - Nelly]
I used to pride myself on being the other man
But now it's flipped and I don't want you with no other man
Why can't you understand that anything I'm offering
I gave you the world, but you just wanted arguing
From the time I picked you up, until the time I dropped you off again
Even if flipped out on at the mall again
""It's all his fault again,"" that's what you're telling all your friends
I ain't pointing fingers ma, I just wanna call again
See how your day going I know they stressing on you
I know them times get hard that's why I'm checking on you
It's yours truly ma, I got a little message for you
Anything he can do, girl I can do better for you, cause

[Bridge - Nelly]
When we laugh or we cry it's together
Through the rain and the stormiest weather
We gon' still be as one it's forever
It's forever, it's forever

[Hook - Jaheim]
Won't you come on and go with me (come and go with me)
(Oh girl) Come on over to my place (my place, my place)
Won't you sit yourself down and take a seat
And let me ease your mind girl, we gon' do it our way (our way)

[Verse 2 - Nelly]
I heard your friend tell a friend that told a friend of mine
That you was thinking that we should do it one more time
If this ain't the truth then hopefully it's not a lie
Cause I ain't got no issue with hitting that another time
We never had a problem with getting it done
Disagreed upon a lot ma, but the sex wasn't one
Now check it I know you get excited (still) when I come around and bite it
(Girl) quit frowning up and quit acting like you don't like it
(I like it) I know you like, (I like it)
You really like it, (I really, really like it)
(I want it), I know you want it, (adore it)
Adore it, (so come let me enjoy it)

[Bridge]

[Hook w/ ad-libs]

[Verse 3 - Nelly] w/ (Jaheim ad-libs)
Shorty, where you been?
Feels like a long time
Long, long time since I seen you
Yes it has, girl
And I know I said some fucked-up things to you before
But girl you know I didn't mean it
I never meant one single word
If I could take back every word I would and more for sure
If I thought that you would believe it
Hey, girl, cause you make my life so convenient for me

[Bridge w/ ad-libs]

[Hook w/ ad-libs]"
3631,Overnight Celebrity,Twista,Twista,Overnight Celebrity Twista,"[Produced by Kanye West]

[Intro]
Oh you didn't think we could do it again
Twista, Kanye West, from Po Pimpin' to Poppin' Tags
From Champions to Slow Jammin', oh baby
We can even make you a overnight celebrity
Know what I'm saying, come on

[Hook: Kanye & Twista]
Why don't we play something these hoes'll like?
Drive whips I know they like
Twista, you told her, right
I could make you a celebrity overnight
Give you ice like Kobe wife
We sorta like Goldie, right
The way we mold 'em right
I could make you a celebrity overnight

[Verse 1: Twista]
Girl I see you in them Apple Bottom jeans
Chinchilla on your back, I wanna know your name
Girl I'm Twista, I could blow your brains
Put you in a chameleon '04 Range
Still sexy when you smoke that flame
Jerk it like a chicken when you throw that thang
She got me hotter than a oven the way that she talk
Switching to freaky so I'm loving the way that she walk
You looking good, girl, you oughta be in pictures
Listen to me, I see your career going sky high
Taking you home to the crib in the Chi
And everytime I see your thighs I cry when I drive by
Watching you should be a thrill, got the fellas on some Johnny Gill
Steady screaming ""my, my, my, my""
Walk on the carpet with the diamonds that flick in the dark
Kicking it on the couch at 106 & Park
I can see your beauty on the big screen
I can see me freaking you with whipped cream
I can see you on stage at the awards
With a dress better than Jennifer's and doing big things
Kick it with me I can mold your life
You looking good girl, show you right
Dre told me you the prototype
I can make you a celebrity overnight

[Hook: Kanye & Twista]
Why don't we play something these hoes'll like?
Drive whips I know they like
Twista, you told her, right
I could make you a celebrity overnight
Give you ice like Kobe wife
We sorta like Goldie, right
The way we mold 'em right
I could make you a celebrity overnight
Why don't we play something these hoes'll like?
Drive whips I know they like
Twista, you told her, right
I could make you a celebrity overnight
Give you ice like Kobe wife
We sorta like Goldie, right
The way we mold 'em right
I could make you a celebrity overnight

[Verse 2: Twista]
You want fame, you can take that path
Candlelights 'fore you take a bath
You got such a sensational ass
I'mma get you Jimmy Choo and Marc Jacob bags
I can cop her a 2003
Make her smile when she sees Spre's
I can get you on CDs and DVDs
Take you to BeBe's and BCBG
I can get you into places to be into
The people to know or show you things to get into
I wanna be your lover and your confidant
And protect you from others, don't ever let a brother pimp you
If you want the style, you can get ya girl
Y'all take a look at her, she got such an astonishing body
I can see ya in some Gucci or Robert Cavalli
And I bet she gon' put a hurt on 'em hard in the party
And you know you kill 'em in the club we go
You was born to be a pro, how you know who's taking photos
And I love you cause you freaky with the door closed
Drop it to the flo', let that go when you roll slow
And I love it when I hit it from the back
And you get on top of me and have a brother going ""oh-oh""
Girl I love how you roll me right
I can make you a celebrity overnight

[Hook: Kanye & Twista]
Why don't we play something these hoes'll like?
Drive whips I know they like
Twista, you told her, right
I could make you a celebrity overnight
Give you ice like Kobe wife
We sorta like Goldie, right
The way we mold 'em right
I could make you a celebrity overnight

[Bridge: Twista]
You see, see baby girl
You see how you make a brother break down
I just gotta ask you, what you need
What you need from me, oh you wanna be a star
Are you messing with the right one
I can take you there, I can make sure
You've got all the finest things
Let me be your manager

[Outro: Twista]
Come here girl, I could see you bored
Tell you you're the queen that I see you for
Take you shopping on sprees in stores
I'mma get you to the MTV awards
We about to do a show tonight
You looking good girl, show you right
Take you places I know you like
I could make you a celebrity overnight
Come here girl, you could hang if you bored
We could do plenty things plus more
I'm about to have you changin' in stores
I can even get you to the Soul Train awards
We about to do a show tonight
You looking good girl, show you right
Take you places I know you like
I could make you a celebrity overnight"
3632,Hotel,Cassidy featuring R. Kelly,Cassidy featuring,Hotel Cassidy featuring,"[Intro - R. Kelly]
Ladies and gentlemen! (uh)
You are listenin to the sounds of Swizz Beatz (uh)
We got Cassidy in here, Kels!
We in our throwbacks (uh), this is for the ladies
We got room keys (Whoooo!)

[Hook - R. Kelly] w/ {Swizz Beatz in background}
Girl you wanna come to my hotel
Baby I will leave you my room key
I'm feelin the way, you carry yo self girl
And I wanna get wit you, cause you's a cutie
So if you wanna come to my hotel
All you gotta do is holla at me
We still havin a after-party
Checkin out six in the mornin
(Six in the mornin, six in the mornin, six in the mornin)
Checkin out six in the mornin
(Six in the mornin, six in the mornin, ...the mornin)

[Verse 1 - Cassidy] + (Swizz Beatz)
(Talk to 'em Cass) I be stayin in a ho-tel, not the mo-tel
Or the Holiday Inn (Say whaaa?!)
If that girl, don't participate
Well then I'm gon' take her friend (Say whaaa?!)
But if, mami is wit it then, mami could get it if
Mami a rider, I'mma slide up inside the bomb
I got a suite, you could creep on through
I know you tryin to get yo freak on too (c'mon)

[Bridge - Cassidy] + (R. Kelly)
I do it all for the (ladies) yeah I ball for the (ladies)
Hit the mall for the (ladies) keep it fly for the (ladies)
Keep my eye on (ladies) hot tub for (ladies)
Pop bub for the (ladies) I got love for my (ladies)

[Hook]

[Verse 2 - Cassidy] + (Swizz Beatz)
We the new car-tel, R. Kel
And the kid Cassidy (Say whaaa?!)
Girl if ya man, start actin up
Ask for him, or ask for me (Say whaaa?!)
Cause see, we could go get it crackin, but you know what'll happen
We be under the covers, makin love to each other
I got a double bed, one to sleep on
The other to get my freak on (frk-frk-frk-frk-frk)

[Bridge - Cassidy] + (R. Kelly)

[Hook]

[Verse 3 - Cassidy]
We goin Chi-Town step it out, to the club lettin out
Then we gon' sex it out, til we all checkin out
I got my chicks, I'm gon' bring to the telly
We bout to do the damn thing, sing to 'em Kelly

[R. Kelly] w/ {Swizz Beatz in background}
It's alright (It's alright)
If you wanna come wit me
If I fill ya fantasy
Baby in my hotel suite
And it's ok (It's ok)
If you wanna party night, til day
I will do anything ya say
Just come - to - my - hotel

[Hook]

[Outro - Swizz Beatz]
You have just heard (you have just heard)
A classic (a classic)
Featuring (featuring)
The one and only (the one and only)
Kels! Cassidy {*scratched - ""R. Kelly""*}
Swizz Beatz the monster (yes I am)
Full Surface the label (yes, yes)
Rockland the family (Rockland the family)
Ruff Ryders the family (Ruff Ryders the family)
Whooo! (whooo!) This one's for the ladies y'all
Th-th-the ladies, the ladies (please believe it)
Getcha hands up (getcha hands up)
Getcha hands up, getcha-getcha hands up (whooo!)
Getcha hands up, getcha-getcha hands up (this part one y'all)
(C'mon!) Getcha hands up, getcha-getcha hands up (part one)
(Ladies!) Getcha hands up, getcha-getcha hands up
(C'mon!) Getcha hands up, getcha-getcha hands up
(Bounce wit a) Getcha hands up, getcha-getcha hands up
(Ladies!) Getcha hands up, getcha-getcha hands up
(Bounce wit a) Getcha hands up, getcha-getcha hands up
(C'mon) Getcha hands up, getcha-getcha hands up..."
