,Song,Artist,artist_trunc,search_term,lyrics_raw
3580,These Words,Natasha Bedingfield,Natasha Bedingfield,These Words Natasha Bedingfield,"These words are my own

Threw some chords together
The combination D-E-F
It's who I am, it's what I do
And I was gonna lay it down for you

I tried to focus my attention
But I feel so A-D-D
I need some help, some inspiration
But it's not coming easily

(Whoa) Tryin' to find the magic
(Whoa) Tryin' to write a classic
(Whoa) Don't cha know, don't cha know, don't cha know?
(Whoa) Wastebin full of paper
Clever rhymes, see ya later

These words are my own, from my heart flow
I love you, I love you, I love you, I love you
There's no other way to better say
I love you, I love you

Read some Byron, Shelley, and Keates
Recited it over a hip-hop beat
I'm havin' trouble sayin' what I mean
With dead poets and a drum machine

You know I had some studio time booked
But I couldn't find the killer hook
Now you're gonna raise the bar right up
Nothin' I write is ever good enough

These words are my own, from my heart flow
I love you, I love you, I love you, I love you
There's no other way to better say
I love you, I love you

These words are my own, from my heart flow
I love you, I love you, I love you, I love you
There's no other way to better say
I love you, I love you

I'm gettin' off my stage
The curtains pull away
No hyperbole to hide behind
My naked soul exposes

(Whoa) Tryin' to find the magic
(Whoa) Tryin' to write a classic
(Whoa) Wastebin full of paper
Clever rhymes, see ya later

These words are my own, from my heart flow
(Don't cha know) I love you, I love you, I love you, I love you
There's no other way to better say
I love you, I love you

These words are my own, from my heart flow
I love you, I love you, I love you, I love you
There's no other way to better say
I love you, I love you

These words are my own
They're from my heart

I love you, I love you
That's all I got to say
Can't think of a better way
And that's all I got to say
I love you, is that okay?"
3581,Don't Lie,The Black Eyed Peas,The Black,Don't Lie The Black,"[Intro: will.i.am & Fergie]
Yeah, uh-uh
La, la, la, la, la
Sorry, sorry, sorry, sorry

[Verse 1: will.i.am]
Hey baby my nose is gettin' big
I noticed it be growin' when I been tellin' them fibs, now
You say your trust's gettin' weaker
Probably 'cause my lies just started gettin' deeper
And the reason for my confession is that I learned my lesson
And I really think you ought to know the truth
Because I lied and I cheated and I lied a little more
But after what you did I don't know what I did it for
I admit that I've been a little immature
With your heart like I was the predator
In my book of lies I was the editor
And the author, I posted my signature
And now I apologize for what I did to ya
'Cause what you did to me I did to you

[Hook: Fergie]
No no no no, baby, no no no no don't lie (because)
No no no no, yeah, no no no no you gotta try
What you gonna do when it all comes out
When I really see you and what you all are about?
No no no no, baby, no no no no don't lie
'Cause you know, you know, you know, you know
You know you gotta try (Stop, st-stop, stop, st-stop stop lying)

[Verse 2: apl.de.ap]
She said I'm leavin'
'Cause she can't take the pain
It's hard to continue this love, it ain't the same
Can't forget the things that I've done inside her brain
Too many lies committed, too many games
She feelin' like a fool gettin' on the last train
Tryna maintain but the feeling won't change
I'm sorry for the things that I've done and what I became
Caught up in living my life in the fast lane
Blinded by lights, cameras, you know the fame
I don't know the reason why I did these things

[Pre-Hook 2: Fergie, will.i.am (& apl.de.ap)]
Oh, when I lie and I lie and I lie and I lie
(And now our emotions are drained)
'Cause I lie and I lie and a little lie, lie
And now your emotions are drained

[Hook 2: Fergie]
No no no no, baby, no no no no don't lie (no, don't you lie)
No no no no, yeah, no no no no, you gotta try (got to, got to try)
What you gonna do when it all comes out (what you gonna do, baby?)
When I really see you and what you all are about?
No no no no, baby, no no no no don't lie
Because you know, you know, you know, you know
You know you gotta try

[Bridge: will.i.am (& Fergie)]
Ooh-ooh ooh ooh, ooh-ooh ooh
Ooh-ooh ooh ooh, ooh-ooh ooh
Ooh-ooh ooh ooh, ooh-ooh ooh
Ooh-ooh ooh ooh, ooh-ooh ooh
Ooh-ooh ooh ooh, ooh-ooh ooh (Ba da, ba da, ba ba ba ba)
Ooh-ooh ooh ooh, ooh-ooh ooh (Ba da da, ba da da, ba da da, ba da da)
Ooh-ooh ooh ooh, ooh-ooh ooh (Ba da, ba da, ba ba ba ba)
Ooh-ooh ooh ooh, ooh-ooh ooh (Ba da da, ba da da, ba da da, ba da da)

[Verse 3: Taboo]
Yo, I'm lying to my girl
Even though I love her and she all in my world
I give her all my attention and diamonds and pearls
She the one that make me feel on top of the world
Still I lie to my girl, I do it

[Pre-Hook 3: Fergie & Taboo]
Oh when I lie and I lie and I lie and then I lie
Till there's not turning back
I don't know why and I lie and I lie
Till I don't know who I am
Let me tell myself

[Hook 3: Fergie]
No no no no, baby, no no no no don't lie (don't you lie)
No no no no, yeah, no no no no, you gotta try (you know, you know you gotta)
What you gonna do when it all comes out
When I really see you and what you all are about?
No no no no, baby, no no no no don't lie
No no no no, baby, no no no no
(Stop, st-stop, stop, st-stop stop lying)"
3582,Get Right,Jennifer Lopez,Jennifer Lopez,Get Right Jennifer Lopez,"[Verse 1]
You're looking just a little too hard at me
Standing just a little too close to me
You're saying not quite enough to me
You're sipping just a little too slow for me
No doubt you play it real cool, homie
Got me thinking what is it you do for me
Tripping a little more than I should be
So let yourself go and get right with me

[Chorus]
I'm about to sign you up, we can get right
Before the night is up, we can get right, get right
(We can get right)
I'm about to fill your cup, we can get right
Before the night is up, we can get right tonight
Before the night is up, we can get right, get right tonight
(We can get right)

[Verse 2]
Your lips talking 'bout I ""play too much""
Can't a woman take advantage of what she wants?
My hips moving oh so slow
Bar tab, looking like a car note
All I need is you here right by my side
Take whatever you want, baby, let's ride
And whatever you won't do, let me decide
Just put your name on the dotted line

[Chorus]
I'm about to sign you up, we can get right
Before the night is up, we can get right, get right
(We can get right)
I'm about to fill your cup, we can get right
Before the night is up, we can get right tonight
Before the night is up, we can get right, get right tonight
(We can get right)

[Bridge]
So much we have got to say, but so little time
And if tonight isn't long enough, don't leave love behind
(Don't leave this love behind)
Baby, take my hand, I will show you why

[Chorus]
I'm about to sign you up, we can get right
Before the night is up, we can get right, get right
(We can get right)
I'm about to fill your cup, we can get right
Before the night is up, we can get right tonight
Before the night is up, we can get right, get right tonight
(We can get right)
I'm about to sign you up, we can get right
Before the night is up, we can get right, get right
(We can get right)
I'm about to sign you up, we can get right
Before the night is up, we can get right, get right
(We can get right)"
3583,Daughters,John Mayer,John Mayer,Daughters John Mayer,"[Verse 1]
I know a girl
She puts the color inside of my world
But she's just like a maze
Where all of the walls all continually change

And I've done all I can
To stand on her steps with my heart in my hands
Now I'm starting to see
Maybe it's got nothing to do with me

[Chorus]
Fathers, be good to your daughters
Daughters will love like you do
Girls become lovers who turn into mothers
So mothers, be good to your daughters too

[Verse 2]
Oh, you see that skin?
It's the same she's been standing in
Since the day she saw him walking away
Now she's left
Cleaning up the mess he made

[Chorus-John Mayer]
Fathers, be good to your daughters
Daughters will love like you do
Girls become lovers who turn into mothers
So mothers, be good to your daughters too

[Verse 3]
Boys, you can break
You find out how much they can take
Boys will be strong
And boys soldier on
But boys would be gone without warmth from
A woman's good, good heart

[Bridge]
On behalf of every man
Looking out for every girl
You are the God and the weight of her world
On behalf of every man
Looking out for every girl
You are the God and the weight of her world

[Chorus]
Fathers, be good to your daughters
Daughters will love like you do
Girls become lovers who turn into mothers
So mothers, be good to your daughters too

[Outro]
So mothers be good to your daughters, too
So mothers be good to your daughters, too"
3584,As Good as I Once Was,Toby Keith,Toby Keith,As Good as I Once Was Toby Keith,"[Verse 1]
She said, ""I've seen you in here before.""
I said, ""I've been here a time or two.""
She said, ""Hello, my name is Bobby Jo
Meet my twin sister Betty Lou
And we're both feeling kinda wild tonight
You're the only cowboy in this place
And if you're up for a rodeo
I'll put a big Texas smile on your face""
I said, ""Girls,""

[Chorus]
I ain't as good as I once was
I got a few years on me now
But there was a time back in my prime
When I could really lay it down
And if you need some love tonight
Then I might have just enough
I ain't as good as I once was
But I'm as good once as I ever was

[Verse 2]
I still hang out with my best friend Dave
I've known him since we were kids at school
Last night he had a few shots
Got in a tight spot hustling a game of pool
With a couple of redneck boys
One great big bad biker man
I heard David yell across the room
""Hey buddy, how 'bout a helping hand?""
I said, ""Dave,""

[Chorus]
I ain't as good as I once was
My, how the years have flown
But there was a time back in my prime
When I could really hold my own
But if you wanna fight tonight
Guess those boys don't look all that tough
I ain't as good as I once was
But I'm as good once as I ever was

[Bridge]
I used to be hell on wheels
Back when I was a younger man
Now my body says, ""You can't do this boy""
But my pride says, ""Oh, yes you can""

[Chorus]
I ain't as good as I once was
That's just the cold hard truth
I still throw a few back, talk a little smack
When I'm feeling bullet proof
So don't double dog dare me now
Cause I'd have to call your bluff
I ain't as good as I once was
But I'm as good once as I ever was
May not be good as I once was
But I'm as good once as I ever was"
3585,Girlfight,Brooke Valentine featuring Lil Jon and Big Boi,Brooke Valentine,Girlfight Brooke Valentine,"[Big Boi]

Boy stop


[Brooke Valentine]

It's about to be a girl fight


[Big Boi]

Uh huh, uh huh Big Boi

(Uh Lil' Jon)


[Lil' Jon]
What?


[Hook: Brooke Valentine (Lil' Jon)]
We 'bout to throw them bows

We 'bout to swang them thangs

We 'bout to throw them bows

We 'bout to swang them thangs

It's 'bout to be a (WHAT) girl fight


[Verse 1: Brooke Valentine]

There she go talkin' her mess

All around town makin' me stress

I need to get off my chest

And if her friend want some then she'll be next

It really ain't all that complicated

Y'all walkin' 'round lookin' all frustrated

Want some, Tex come on let's make it

You actin' real hard but I know your fakin'


[Bridge: Brooke Valentine (Lil' Jon)]

I know you really don't wanna listen to this

Really don't know why you talkin' shit

You about to catch one right in ya lip

It's 'bout to be a (WHAT) girl fight

I know you really don't wanna listen to this

Really don't know why you talkin' shit

You about to catch one right in ya lip

It's 'bout to be a (WHAT) girl fight


[Hook: Brooke Valentine (Lil' Jon) with variations]


[Verse 2: Brooke Valentine]

We on our way to the neighborhood

The reason we comin' is understood

Me and my girls we down to ride

So when ya hear us pull up bring ya ass outside

And if tryin' to call ya cousin and them

Don't forget that I got some of them

I'm 'bout to go real hard, 'bout to swing them thangs

You 'bout to feel elbows all in ya brains


[Bridge: Brooke Valentine (Lil' Jon)]

I know you really don't wanna listen to this

Really don't know why you talkin' shit

You about to catch one right in ya lip

It's 'bout to be a (WHAT) girl fight


[Hook: Brooke Valentine (Lil' Jon) with variations]


[Big Boi]

Oh snap, these bitches they act like cats

In the middle of the dance floor, now they preparing to scrap
They takin' out their scrunchies and pullin' off their Press-Ons

The one on the right is the girlfriend and the one the left is the other

Woman

Someone please call security
These girls too purty, to get down to the nitty titty

I mean the nitty gritty, I mean her titties pretty

I'm trippin' bein' silly willy

Man go on let them hoes fight


[Hook: Brooke Valentine (Lil' Jon) with variations]


[Outro: Brooke Valenine with ad-libs]

Don't act like you dont know

We break upside ya dome

So be quick enough to block ya dome

And you won't be talkin' that no more


Don't act like you dont know

We break upside ya dome

So be quick enough to block ya dome

And you won't be talkin' that no more

Bitch come outside"
3586,Lose My Breath,Destiny's Child,Destiny's Child,Lose My Breath Destiny's Child,"[Intro]
Hit me!

[Hook]
Can you keep up?
Baby boy, make me lose my breath
Bring the noise, make me lose my breath
Hit me Hard, make me lose my (Hah Hah)
Can you keep up?
Baby boy, make me lose my breath
Bring the noise, make me lose my breath
Hit me Hard, make me lose my breath (Hah Hah)

[Verse 1: Beyonce]
OOOh
I put it right there, made it easy for you to get to
Now you wanna act like ya don't know what to do
After I done everything that you asked me
Grabbed you, grind you, liked you, tried you
Moved so fast baby now I can't find you

OOOh
I'm startin' to believe that I'm way too much for you
All that talk but it seems like it can't come through
All them lies like you could satisfy me
Now I see where believing you got me
Gave you the wheel, but you can't drive me

[Hook]
Can you keep up?
Baby boy, make me lose my breath
Bring the noise, make me lose my breath
Hit me Hard, make me lose my (Hah Hah)
Can you keep up?
Baby boy, make me lose my breath
Bring the noise, make me lose my breath
Hit me Hard, make me lose my breath (Hah Hah)

[Verse 2: Kelly]
OOOh
Two things I don't like when I tryin' to get my groove
Is a partna that meets me only half way and just can't prove
Take me out so deep when you know you can't swim
Need a lifeguard and I need protection
To put it on me deep in the right direction

OOOh
You understand the facts that I'm tryin' to give to you
You movin' so slow like you just don't have a clue
Didn't mama teach you to give affection?
I know the difference of a man and an adolescent
It ain't you boo, so get to steppin'

[Hook]
Can you keep up?
Baby boy, make me lose my breath
Bring the noise, make me lose my breath
Hit me Hard, make me lose my (Hah Hah)
Can you keep up?
Baby boy, make me lose my breath
Bring the noise, make me lose my breath
Hit me Hard, make me lose my breath (Hah Hah)
Can you keep up?
Baby boy, make me lose my breath
Bring the noise, make me lose my breath
Hit me Hard, make me lose my (Hah Hah)
Can you keep up?
Baby boy, make me lose my breath
Bring the noise, make me lose my breath
Hit me Hard, make me lose my breath (Hah Hah)

[Bridge: Michelle]
If you can't make me say OOO
Like the beat of this drum
Why you ask for some and you really want none
If you can't make me say OOO
Like the beat of this groove

[All]
You don't have no business in this here's your papers
Baby you are dismissed, dismissed, dismissed....

[Hook]
Can you keep up?
Baby boy, make me lose my breath
Bring the noise, make me lose my breath
Hit me Hard, make me lose my (Hah Hah)
Can you keep up?
Baby boy, make me lose my breath
Bring the noise, make me lose my breath
Hit me Hard, make me lose my breath (Hah Hah)
Can you keep up?
Baby boy, make me lose my breath
Bring the noise, make me lose my breath
Hit me Hard, make me lose my (Hah Hah)
Can you keep up?
Baby boy, make me lose my breath
Bring the noise, make me lose my breath
Hit me Hard, make me lose my breath (Hah Hah)"
3587,Ordinary People,John Legend,John Legend,Ordinary People John Legend,"[Intro]
Oh, oh, oh, oh

[Verse 1]
Girl, I'm in love with you
But this ain't the honeymoon
We've passed the infatuation phase
We're right in the thick of love
At times we get sick of love
It seems like we argue every day
I know I misbehaved
And you made your mistakes
And we've both still got room left to grow
And though love sometimes hurts
I still put you first
And we'll make this thing work
But I think we should take it slow

[Hook]
We're just ordinary people
We don't know which way to go
Cause we're ordinary people
Maybe we should take it slow
Take it slow, oh oh, this time we'll take it slow
Take it slow, oh oh, this time we'll take it slow

[Verse 2]
This ain't a movie, no
No fairytale conclusion y'all
It gets more confusing every day
Sometimes it's Heaven sent
Then we head back to Hell again
We kiss, then we make up on the way
I hang up, you call
We rise and we fall
And we feel like just walking away
As our love advances
We take second chances
Though it's not a fantasy
I still want you to stay

[Hook]
We're just ordinary people
We don't know which way to go
Cause we're ordinary people
Maybe we should take it slow
Take it slow, oh oh, this time we'll take it slow
Take it slow, oh oh, this time we'll take it slow

[Verse 3]
Maybe we'll live and learn
Maybe we'll crash and burn
Maybe you'll stay
Maybe you''ll leave
Maybe you'll return
Maybe another fight
Maybe we won't survive
Maybe we'll grow
We'll never know
Baby, you and I

[Hook]
We're just ordinary people
We don't know which way to go
Cause we're ordinary people
Maybe we should take it slow
Take it slow, oh oh, this time we'll take it slow
Take it slow, oh oh, this time we'll take it slow"
3588,We Be Burnin',Sean Paul,Sean Paul,We Be Burnin' Sean Paul,"[Intro]
Just gimme the gees an we be clubbin' yo
Gyal a make we please and we be thuggin' now
Sipping Hennessy and we be bubblin' yo
Set yuh mind at ease we gotta take it slow

[Verse 1]
So when you see the S.P. floating don't provoke him
Cause the girls we be poking ganja smoking
Best thing for the recreation to get the best girls in every nation
Topper girls we promotin' and supportin'
And them love how we flow king hear them shouting
First class ticket invitation gyal from New York, England and Jamaican
Everyday

[Hook]
We be burnin' not concernin' what nobody wanna say
We be earnin' dollars turning cah' we mind de pon we pay
More than gold and oil and diamonds, girls, we need them everyday
Recognize it, pimpin' as we riding

[Verse 2]
Girls them a page me want to raise me
True me write enough tune and drive them crazy
Well I man a true born Jamaican
Ready fi di girls them in every situation

We a the gyal them pro, them know we flow
With the lyrical content that make them dip low and
Make the club keep jumpin'
Turn up the bass when you hear this pumpin'
Summertime bounce to the music people choose it
Sean the P gal a cruise with... well reputed
Cause we a the girls them champion
Got 'nuff a dem like the great king Solomon
Many girls in a with eye sight sexy dress type
Se them ready for a hype night
Just gimme the light
An make we blaze it the roof we haffi raise it again

[Hook]
We be burnin' not concernin' what nobody wanna say
We be earnin' dollars turning cah' we mind de pon we pay
More than gold and oil and diamonds, girls, we need them everyday
Recognize it, pimpin' as we riding

[Intro]
Just gimme the gees an we be clubbin' yo
Gyal a make we please and we be thuggin' now
Sipping Hennessy and we be bubblin' yo
Set yuh mind at ease we gotta take it slow

[Verse 1]
So when you see the S.P. floating don't provoke him
Cause the girls we be poking ganja smoking
Best thing for the recreation to get the best girls in every nation
Topper girls we promotin' and supportin'
And them love how we flow king hear them shouting
First class ticket invitation gyal from New York, England and Jamaican
Everyday

[Hook]
We be burnin' not concernin' what nobody wanna say
We be earnin' dollars turning cah' we mind de pon we pay
More than gold and oil and diamonds, girls, we need them everyday
Recognize it, pimpin' as we riding
Again
We be burnin' not concernin' what nobody wanna say
We be earnin' dollars turning cah' we mind de pon we pay
More than gold and oil and diamonds, girls, we need them everyday
Recognize it, pimpin' as we riding

[Intro]
Just gimme the gees an we be clubbin' yo
Gyal a make we please and we be thuggin' now
Sipping Hennessy and we be bubblin' yo
Set yuh mind at ease we gotta take it slow"
3589,Just the Girl,The Click Five,The Click,Just the Girl The Click,"[Verse 1]
She's cold and she's cruel
But she knows what she's doin'
She pushed me in the pool
At our last school reunion
She laughs at my dreams
But I dream about her laughter
Strange as it seems
She's the one I'm after

[Chorus]
Cause she's bittersweet
She knocks me off of my feet
And I can't help myself
I don't want anyone else
She's a mystery
She's too much for me
But I keep comin' back for more
She's just the girl I'm lookin' for

[Verse 2]
She can't keep a secret
For more than an hour
She runs on 100 proof attitude power
And the more she ignores me
The more I adore her
What can I do?
I'd do anything for her

[Chorus]
Cause she's bittersweet
She knocks me off of my feet
And I can't help myself
I don't want anyone else
She's a mystery
She's too much for me
But I keep comin' back for more
She's just the girl I'm lookin' for

[Bridge]
And when she sees it's me
On her caller ID
She won't pick up the phone
She'd rather be alone
But I can't give up just yet
Cause every word she's ever said
Is still ringin' in my head
Still ringin' in my head
She's cold and she's cruel
But she knows what she's doin'
Knows just what to say
So my whole day is ruined

[Chorus]
Cause she's bittersweet
She knocks me off of my feet
And I can't help myself
I don't want anyone else
She's a mystery
She's too much for me
But I keep comin' back for more
She's just the girl I'm lookin' for
Cause she's bittersweet
She knocks me off of my feet
And I can't help myself
I don't want anyone else
She's a mystery
She's too much for me
But I keep comin' back for more
Oh, I keep comin' back for more
She's just the girl I'm lookin' for
Just the girl I'm lookin' for

[Outro]
Just the girl
I'm lookin' for
She's just the girl
I'm lookin' for
Just the girl
I'm lookin' for
Just the girl I'm lookin' for"
3590,True,Ryan Cabrera,Ryan Cabrera,True Ryan Cabrera,"I won't talk
I won't breathe
I won't move till you finally see
That you belong with me

You might think I don't look
But deep inside in the corner of my mind
I'm attached to you
Mmmm

I'm weak, it's true
Cause I'm afraid to know the answer
Do you want me too?
Cause my heart keeps falling faster

[Chorus]
I've waited all my life to cross this line
To the only thing thats true
So I will not hide
It's time to try anything to be with you
All my life I've waited
This is true

You don't know what you do
Everytime you walk into the room
I'm afraid to move

I'm weak, it's true
I'm just scared to know the ending
Do you see me too?
Do you even know you met me?

[Chorus]
I've waited all my life to cross this line
To the only thing thats true
So I will not hide
It's time to try anything to be with you
All my life I've waited
This is true

I know when I go
I'll be on my way to you
The way that's true

[Chorus]
I've waited all my life to cross this line
To the only thing thats true
So I will not hide
It's time to try anything to be with you
All my life I've waited
This is true"
