,Song,Artist,artist_trunc,search_term,lyrics_raw
3663,Fuck It (I Don't Want You Back),Eamon,Eamon,Fuck It (I Don't Want You Back) Eamon,"[Produced by Milk Dee]

[Intro: Eamon]
Whoa, ooh
Ooh-hooh
No, no, no

[Verse 1: Eamon]
See, I don't know why I liked you so much
I gave you all of my trust
I told you, I loved you
Now that's all down the drain
You put me through pain
I wanna let you know how I feel

[Hook: Eamon]
Fuck what I said, it don't mean shit now
Fuck the presents, might as well throw 'em out
Fuck all those kisses, they didn't mean jack
Fuck you, you ho, I don't want you back
Fuck what I said, it don't mean shit now
Fuck the presents, might as well throw 'em out
Fuck all those kisses, they didn't mean jack
Fuck you, you ho, I don't want you back

[Verse 2: Eamon]
You thought you could keep this shit from me, yeah?
Ya burnt bitch, I heard the story
You played me, you even gave him head
Now you're askin' for me back
You're just another act
Look elsewhere, 'cause you're done with me

[Hook: Eamon]
Fuck what I said, it don't mean shit now
Fuck the presents, might as well throw 'em out
Fuck all those kisses, they didn't mean jack
Fuck you, you ho, I don't want you back
Fuck what I said, it don't mean shit now
Fuck the presents, might as well throw 'em out
Fuck all those kisses, they didn't mean jack
Fuck you, you ho, I don't want you back

[Bridge: Eamon]
Oh-oh, oh-oh, uh-uh, yeah
Oh-oh, oh-oh, uh-uh, yeah
Oh-oh, oh-oh, uh-uh, yeah
Oh-oh, oh-oh, uh-uh, yeah

[Verse 3: Eamon]
You questioned, did I care?
You could ask anyone
I even said you were my great one
Now it's over
But I do admit I'm sad
It hurts real bad
I can't sweat that, 'cause I loved a ho

[Hook: Eamon]
Fuck what I said, it don't mean shit now
Fuck the presents, might as well throw 'em out
Fuck all those kisses, they didn't mean jack
Fuck you, you ho, I don't want you back

[Outro: Eamon (& Marsha ""Motha"" Donigan)]
Oh-oh, oh-oh, uh-uh, yeah
Oh-oh, oh-oh, uh-uh, yeah
Oh-oh, oh-oh, uh-uh, yeah
Oh-oh, oh-oh, uh-uh, yeah
Oh-oh, oh-oh, uh-uh, yeah (It don't mean shit now)
Oh-oh, oh-oh, uh-uh, yeah (Might as well throw 'em out)
Oh-oh, oh-oh, uh-uh, yeah (They didn't mean jack)
Oh-oh, oh-oh, uh-uh, yeah (I don't want you back)
Oh-oh, oh-oh, uh-uh, yeah (It don't mean shit now)
Oh-oh, oh-oh, uh-uh, yeah (Might as well throw 'em out)
Oh-oh, oh-oh, uh-uh, yeah (They didn't mean jack)"
3664,Read Your Mind,Avant featuring Snoop Dogg,Avant featuring,Read Your Mind Avant featuring,"Listen, I've been waiting to tell you this
You are more than a man could ever want
WAIT A MINUTE JUST LET ME
Listen

Bum bum bum bum bum bum bum bum
Bum bum bum bum bum bum bum bum
BUM BUM BUM
Yeah yeah... yeah... yeeeah

Bum bum bum bum bum bum bum bum
Bum bum bum bum bum bum bum bum
BUM BUM BUM
Yeah

Baby I stepped in the club in your hood
I slowly turned left and there you stood
You and your friends talking
But when I eyes connect I knew then
It was just like two waves on beat
I'm your king, be my queen
And what do you want to do tonight
My truck is parked out front, so lets ride

(Chorus:)
I can read you mind baby
And I know what your thinking
But its alright (with me baby), it's alright (with me) baby (x2)

So baby take a ride with me
And I'll fulfill all your fantasies
And when the rain starts pouring down
Then all the love that's lost will be found
I'll make your mind lose control
Over your body, thats my goal
So baby just come and down here
Just let the gravity pull you near

(Chorus x2)

(HOOK: (X2))
I know you wanna rub
I know you wanna touch
I know you wanna feel
So baby keep it real

I know you wanna see
I know you wanna be
In my b-e-d
Grinding slowly (breathing)

(CHORUS (X2))
(Breakdown:)
I wanna LOVE baby
I wanna feel you
(IF YOU COME, IF YOU COME)
I WANNA LOVE baby
I wanna feel you (I WANNA FEEL YOU)

Come on and go with me
I want you to stay with me (x2)"
3665,Game Over (Flip),Lil' Flip,Lil' Flip,Game Over (Flip) Lil' Flip,"[Intro : Maître Gims]
Tu sais les mecs comme moi très souvent ça déçoit
Très souvent ça disparaît, ça fait de sales histoires
J'te mentirai des fois, pour rentrer tard le soir
Faut qu'tu saches ma grande je ne suis pas un mec pour toi

[Refrain 1 : Maître Gims]
J'vais finir par m'sauver, sauver, sauver
Je n'suis pas un lover, lover, lover
J'me comporte comme un loser, loser, loser
Donc j'vais finir par m'sauver, sauver, sauver
Yeah

[Couplet 1 : Vitaa]
Tu sais les filles comme moi font pleurer les gars comme toi
Au début, tu penses me tenir, c'est parfait
J'te laisse croire qu'j'suis naïve, t'as l'espoir qu'j't'obéisse
Tu finiras par attendre mes appels
Tu crois qu'une fille comme moi en est à son coup d'essai
Moi, j'infiltrais ton phone-tel' quatre ans en arrière
Il est encore temps pour toi d'émettre tes regrets
On ne touchera pas ta caisse si tu me rends mes affaires

[Refrain 2 : Vitaa]
Tu finiras par tomber, tomber, tomber
Tu m'supplieras d't'écouter, saoulé, saoulé
Tu vas finir par sombrer, sombrer, sombrer
C'est toi qu'as voulu jouer, jouer, jouer

[Couplet 2 : Maître Gims]
Je suis les griffes de la nuit, je m'en vais quand tu roupilles, j'enfile mes meilleurs habits, j'ai un problème comme Nicky
Je t'ai changé, c'est bien plus qu'un petit coup d'pouce, Cendrillon ? Bibbidi-Bobbidi-Boo !
T'es foutue si j'te laisse dans cette situation
Ah ! Hin hin, plus de cadeau, t'es l'ombre de mon ombre, ewer Pussycat Dolls! Han
Cindy sois pas fâchée, pour t'oublier, j'ai dû t'imaginer en train d'chier !
Regarde-toi dans la glace, j'étais p't-être le seul type qui n'avais jamais vu le Pink Paradise
Ohw shit, bye t'es plus de la mif', on va t'négliger comme l'ami d'un ami
J'devais t'présenter à Karl Lagerfeld, mais t'as merdé, vas-y file !

[Couplet 3 : Vitaa]
Tu penses à qui quand je rentre sur le beat ?
Toi qui disais ""Vitaa-Gims sur un feat' : mais c'est quel titre ?""
Maintenant, dis-moi, qui te met la pression sur le beat ?
Et, si tu danses, c'est que Vitaa-Gims, en scrèd', ont fait un hit

[Couplet 4 : Maître Gims & Vitaa]
Tu vas regretter tous ces moments à t'accrocher comme ça
Comment regretter quand c'est moi qui décide que tout s'arrête là ?
Tu n'reverras plus de mec comme moi, toi, tu m'as prise pour une groupie du Wa'
J't'avais prévenu, je n'reste pas, je t'en prie, je n'te retiens pas

[Refrain 1 : Maître Gims]
J'vais finir par m'sauver, sauver, sauver
Je n'suis pas un lover, lover, lover
J'me comporte comme un loser, loser, loser
Donc j'vais finir par m'sauver, sauver, sauver
Yeah

[Refrain 2 : Vitaa]
Tu finiras par tomber, tomber, tomber
Tu m'supplieras d't'écouter, saoulé, saoulé
Tu vas finir par sombrer, sombrer, sombrer
C'est toi qu'as voulu jouer, jouer, jouer

[Outro : Vitaa]
Tu m'diras ""Vi', assieds-toi, faut qu'j'te parle, j'ai passé ma journée dans le noir
""Tu m'supplieras d'écouter, dégoûté, tu n'pourras pas m'oublier
""Vi', assieds-toi, faut qu'j'te parle, j'commence à en avoir marre""
Tu m'supplieras d'arrêter, c'est cramé, c'est toi qu'a voulu jouer"
3666,One Thing,Finger Eleven,Finger Eleven,One Thing Finger Eleven,"Restless tonight
Cause I wasted the light
Between both these times
I drew a really thin line
It’s nothing I planned
And not that I can
But you should be mine
Across that line

[Chorus:]
If I traded it all
If I gave it all away for one thing
Just for one thing
If I sorted it out
If I knew all about this one thing
Wouldn’t that be something

I promise I might
Not walk on by
Maybe next time
But not this time

Even though I know
I don’t want to know
Yeah I guess I know
I just hate how it sounds

[Chorus x2]

Even though I know
I don’t want to know
Yeah I guess I know
I just hate how it sounds

Even though I know
I don’t want to know
Yeah I guess I know
I just hate how it sounds

[Chorus x3]"
3667,Headsprung,LL Cool J,LL Cool,Headsprung LL Cool,"[Verse - L.L. Cool J]
They call me Big L'y, Big Silly
Big Money, Big Billy
When I'm sliding in them all can ya hear me?
I be sexing wit these bars so ya feel me
Let me grip it up for cuz in the back
Let me grip it get a buzz in ya hat
I'm a tell ya how to cause an attack
Timbaland, Ladies Love on the track
Lovely get the ice, pop champagne
Don't forget I used to ride on the train
When I bump it right, call my name
Go crazy in the mall wit James
Dump that, not ill like me
Bring the women in to chill for free
Let me tell ya girl, don't try me
You better have I.D.!

[Hook - Timbaland] (2x)
When we be up in the club
We be posting the back
When we be in the club
Girl always come to the back
And we bout to get our head sprung
And we bout to get our head sprung
And we bout to get our head sprung
And we bout to get our head sprung

[Verse - L.L. Cool J]
Lord have mercy! If the broad is thirsty
I'll have her man reimburse me
The part that hurts me, is when they try to work me
But I could never let ya jerk me
Steady sticking to the wall, give it up
Sneaking through the back door live it up
Got the champagne, pour me a cup
Got the girls looking raw in the front
Got a call your man's in town
Tell the bar, a-nother round
Got all my mans holding me down
Kinda thick ma, let's get down, so get wit it
I'm saying what time wanna dip wit it?
Got playas on the grind, wanna skip wit it
Backstage you mine, I'm a spit wit it, hey!

[Hook]
When we be up in the club
We be posting the back
When we be in the club
Girl always come to the back
And we bout to get our head sprung
And we bout to get our head sprung
And we bout to get our head sprung
And we bout to get our head sprung

[Bridge - L.L. Cool J] (Ladies) ((Fellas))
Hey ladies! (Yeah!) no need to get your hair done
I said yo ladies! (Yeah!) no need to get your hair done
I'm a get your head sprung, I'm a get your head sprung
I'm a get your head sprung, I'm a get your head sprung
I said yo fellas ((Yo!)) no need to throw them ones
I said yo fellas ((Yo!)) no need to throw them ones
I'm a get your head sprung, I'm a get your head sprung
I'm a get your head sprung, I'm a get your head sprung (Hey!)

[Hook]
When we be up in the club
We be posting the back
When we be in the club
Girl always come to the back
And we bout to get our head sprung
And we bout to get our head sprung
And we bout to get our head sprung
And we bout to get our head sprung

[Outro - Timbaland]
Yeah! Keep chillin wit em, yeah"
3668,Damn!,YoungBloodZ featuring Lil Jon,YoungBloodZ featuring,Damn! YoungBloodZ featuring,"[Verse 1 - Sean Paul]
They calling me to come back to the streets
Sean P., aka ""A Sharp Crease""
Said it was necessary, these sucka niggas out here very scary
They cuffin hoes, they living in the month of February
OK then, put a sissy nigga on display then
Kick in your door and have my folks bring them K's in
I'm still Attic A-double T-I-C
It ain't a ho out there, for real, who don't know bout me
Bitch I'm fo sho with it
Don't make me pop that trunk to the 'Lac
Bitch I will go get it
And I ain't selfish, I will let you and your ho feel it
Won't catch me sipping on no Cris and got a cold belly
It's Youngbloodz A-Town malt liquor sipping
Coming straight from the gutter
Toe-tag a motherfucker, leave em under a cover
Lil John he drop the beat that make you bounce like rubber
Sean Paul he tote the heat to make you mug then slug ya, yeah

[Hook: Lil Jon]
If you don't give a damn, we don't give a fuck
Don't start no shit, it won't be no shit

[Verse 2 -J-Bo]
I post up get to it, drink hand in hand
They call me Mr. Herringbone cause that's my right hand man
Old-school straight foolish like no other indeed
With Lil John, it's Youngbloodz, they crunk as can be
Attic Crew 105 that's if you looking to rumble
Cock back bust aim now I done got your number
In the club you gone feel it when it drop this summer
Like rain we gone pour and hit you hard like thunder
Cause in the Dirty we them boys that drank you under the table
Where them niggas pimp hoes in fly suits and gators
In my Chevy so super I'm the one to call
Just dial 1-800-430 slash ALCOHOL
And dawg I'm not the one that you really just wanna clown
I'm cool in my way, but shit still I shut 'em down
And piss on them haters J-Bo he cuts a fool
In the cut bout slizzard somewhere that's how we do

[Hook]

[Verse 3 - Sean Paul]
Out of town hard heads get swiss cheesed up
And you gonna need more than stitches to patch that leak up
Chump like me up my mouth TB'd up
With the plush leather guts steady gripping the butt
Oh you fo sho with it, then pull your pistol
Show a nigga you ain't ho with it
And I ain't selfish I will let you and your folk feel it
Talking big-boy shit
Mean-muggin' like a motherfucker, my hand on my dick

[J-Bo]
Cause at a grip we keep it jumping like it ain't nothing new
We started off with Shake Em Off so look partner, oh guess who?
It's them boys from the bottom who took you down 85
And hit you with that U-Way so don't be surprised
We buckin' blowin' chillin' and sippin' on something good
I'm peepin' out the scenery and wishin' a nigga would
In case it just might pop I'm 'bout ready to lock and load
To take you thru the South to show you how we throw dem bows"
3669,Baby Boy,Beyonce featuring Sean Paul,Beyonce featuring,Baby Boy Beyonce featuring,"[Intro: Sean Paul]
Certified quality
A dat da girl dem need and dem not stop cry without apology
Buck dem da right way – dat my policy
Sean Paul alongside – now hear what da man say – Beyonce
Dutty ya, dutty ya, dutty ya
Beyonce sing it now ya

[Chorus: Beyoncé & Sean Paul]
Baby boy you stay on my mind
Fulfill my fantasies (come on girl, tell me how you feel)
I think about you all the time
I see you in my dreams
Baby boy not a day goes by
Without my fantasies (come on girl, tell me what's the deal)
I think about you all the time
I see you in my dreams

[Verse 1: Beyoncé]
Aah oh my baby's fly baby oh
Yes no hurt me so good baby oh
I'm so wrapped up in your love, let me go
Let me breathe, stay out my fantasies

[Verse 2: Sean Paul]
Ya ready gimme da ting dat ya ready get ya live
And tell me all about da tings that you will fantasize
I know you dig da way me step da way me make my stride
Follow your feelings baby girl because they cannot be denied
Come check me in-a night and make we get it amplified
Me have da ting to run da ship cause I'm go slip and I'm go slide
And in the words of love I got ta get it certified
But I give you da toughest longest kinda ride – girl

[Chorus: Beyoncé & Sean Paul]
Baby boy you stay on my mind
Fulfill my fantasies (come on girl, tell me how you feel)
I think about you all the time
I see you in my dreams
Baby boy not a day goes by
Without my fantasies (come on girl, tell me what's the deal)
I think about you all the time
I see you in my dreams

[Verse 3: Beyoncé]
Picture us dancin' real close
In a dark dark corner of a basement party
Every time I close my eyes
It's like everyone left but you and me
In our own little world
The music is the sun
The dancefloor becomes the sea
Feels like true paradise to me

[Chorus: Beyoncé & Sean Paul]
Baby boy you stay on my mind
Fulfill my fantasies (come on girl, tell me how you feel)
I think about you all the time
I see you in my dreams
Baby boy not a day goes by
Without my fantasies (come on girl, tell me what's the deal)
I think about you all the time
I see you in my dreams

[Bridge: Beyoncé]
Baby boy, you stay on my mind
Baby boy, you are so damn fine
Baby boy, won't you be mine
Baby boy, let's conceive an angel
Baby boy, you stay on my mind
Baby boy, you are so damn fine
Baby boy, won't you be mine
Baby boy, let's conceive an angel

[Verse 4: Sean Paul]
Top top – girl
Me and you together is a wrap – dat girl
Driving around da town in your drop top – girl
You no stop shock – girl
Little more da dutty, we'll rock dat world
Top top – girl
Me and you together is a wrap – dat girl
Driving around da town in your drop top – girl
You no stop shock – girl
Little more da dutty, we'll rock dat world

[Chorus: Beyoncé]
Baby boy you stay on my mind
Fulfill my fantasies (come on girl, tell me how you feel)
I think about you all the time
I see you in my dreams
Baby boy not a day goes by
Without my fantasies (come on girl, tell me what's the deal)
(Oh, na, na, na) I think about you all the time
I see you in my dreams

[Outro: Beyoncé + Sean Paul]
We stepping in hotter this year
We stepping in hotter this year
I know you gon' like it
I know you gon' like it
I'm stepping in hotter this year
I'm stepping in hotter this year
So don't you fight it
So don't you fight it"
3670,Get Low,Lil Jon & the East Side Boyz featuring Ying Yang Twins,Lil Jon,Get Low Lil Jon,"[Hook]
3, 6, 9 - damn she fine
Hoping she can sock it to me one more time
Get low, get low, get low get low!
To the window, to the wall!
Til the sweat drop down my balls
Til all these bitches crawl
Til all skeet skeet motherfuckers, all skeet skeet god damn!
Til all skeet skeet motherfuckers, all skeet skeet god damn!

[Verse 1]
Shorty crunk - so fresh, so clean
Can she fuck? That question been harassing me
In the mind. This bitch is fine!
I done came to the club about 50 11 times
Now can I play with your panty line?
The club owner said I need to calm down
Security guard go to sweating me now
Nigga drunker than a motherfucker, threaten me now
She getting crunk in the club, I mean she work it
And I like to see the females twerking
Taking the clothes off - buckey naked
ATL - ho, don't disrespect it
P-pop your pussy like this
Cause Yin Yang Twins in this B-I-itch
Lil Jon and the East Side Boys with me
And we all like to see ass and titties
Now bring your ass over here, ho
And let me see you get low if you want this thug
Now take it to the floor - and if your ass want to act
You can keep your ass where you're at

[Hook]

[Verse 2 - Lil Jon]
Let me see you get low (You scared!)
Drop that ass to the floor (You scared!)
Drop that ass yea, shake it fast yea
Pop that ass to the left and the right yea
Now back, back, back it up
Now stop (oh!) then wiggle with it (yea!)

[Hook]

[Verse 3]
Now give me my dub back and go get your friend
Stupid bitch standing there while I'm drinking my Hen
Steady looking at me still asking questions
Time's up - nigga, pass me another contestant
Ho move to the left if you ain't bout 50
Done talked through 3 or 4 songs already
Looking at a nigga with your palm out
Bitch, I ain't even seen you dance!
Twerk something baby, work something baby
Pop your pussy on the pole, do your thang baby
Slide down that bitch a little bit then stop
Get back on the floor, catch your balance then drop
Now bring it back up, clap your ass like hands
I just wanna see your ass dirty dance
Yin Yang we done done again
And put it on the map like ""hah?!""

[Outro]
Ya'll twerking a little bit ladies
But you got to twerk a little bit harder than that
Right now, I need all the ladies that know they look good tonight
We want ya'll to do this shit like this:
Bend over to the front, touch your toes!
Back that ass up and down and get low
Bend over to the front, touch your toes!
Back that ass up and down and get low"
3671,Drop It Like It's Hot,Snoop Dogg featuring Pharrell,Snoop Dogg,Drop It Like It's Hot Snoop Dogg,"[Produced by The Neptunes]

[Intro]
Snooooooooooop
Snooooooooooop

[Hook: Snoop Dogg]
When the pimp's in the crib, ma
Drop it like it's hot, drop it like it's hot, drop it like it's hot
When the pigs try to get at you
Park it like it's hot, park it like it's hot, park it like it's hot
And if a nigga get a attitude
Pop it like it's hot, pop it like it's hot, pop it like it's hot
I got the Rolly on my arm, and I'm pourin' Chandon
And I roll the best weed, ‘cause I got it goin' on

[Verse 1: Pharrell]
I'm a nice dude, with some nice dreams
See these ice cubes? See these Ice Creams?
Eligible bachelor, million-dollar boat
That's whiter than what's spillin' down your throat
The Phantom, exterior like fish eggs
The interior like suicide wrist red
I can exercise you, this can be your Phys. Ed
Cheat on your man, ma, that's how you get ahizzead
Killer with the beat, I know killers in the street
With the steel that'll make you feel like Chinchilla in the heat
So don't try to run up on my ear
Talkin' all that raspy shit, tryin' to ask me shit
When my niggas fill your vest they ain't gon' pass me shit
You should think about it, take a second (Ding)
Matter fact, you should take four, b
And think before you fuck with lil Skateboard P

[Hook: Snoop Dogg]
When the pimp's in the crib, ma
Drop it like it's hot, drop it like it's hot, drop it like it's hot
When the pigs try to get at you
Park it like it's hot, park it like it's hot, park it like it's hot
And if a nigga get a attitude
Pop it like it's hot, pop it like it's hot, pop it like it's hot
I got the Rolly on my arm, and I'm pourin' Chandon
And I roll the best weed, ‘cause I got it goin' on

[Verse 2: Snoop Dogg]
I'm a gangsta, but y'all knew that
Da Big Boss Dogg, yeah, I had to do that
I keep a blue flag hangin' out my backside
But only on the left side, yeah, that's the Crip side
Ain't no other way to play the game the way I play
I cut so much you thought I was a DJ
""Two, one, yep, three!""
S-N double O-P, D-O double G
I can't fake it, just break it, and when I take it
See, I specialize in makin' all the girls get naked
So bring your friends, all of y'all come inside
We got a world premiere right here, now get live!
So don't change the dizzle, turn it up a little
I got a livin' room full of fine dime brizzles
Waitin' on the Pizzle, the Dizzle and the Chizzle
G's to the bizzack—now, ladies, here we gizzo!

[Hook: Snoop Dogg]
When the pimp's in the crib, ma
Drop it like it's hot, drop it like it's hot, drop it like it's hot
When the pigs try to get at you
Park it like it's hot, park it like it's hot, park it like it's hot
And if a nigga get a attitude
Pop it like it's hot, pop it like it's hot, pop it like it's hot
I got the Rolly on my arm, and I'm pourin' Chandon
And I roll the best weed, ‘cause I got it goin' on

[Verse 3: Snoop Dogg]
I'm a bad boy, with a lot of hoes
Drive my own cars, and wear my own clothes
I hang out tough, I'm a real boss
Big Snoop Dogg, yeah, he's so sharp
On the TV screen and in the magazines
If you play me close, you're on a red beam
Oh, you got a gun, so you wanna pop back?
AK-47 now, nigga, stop that!
Cement shoes, now I'm on the move
Your family's cryin', now you on the news
They can't find you, and now they miss you
Must I remind you, I'm only here to twist you
Pistol-whip you, dip you, then flip you
Then dance to this mothafuckin' music we Crip to
Subscribe, nigga, get your issue
Baby, come close, let me see how you get loose!

[Hook: Snoop Dogg]
When the pimp's in the crib, ma
Drop it like it's hot, drop it like it's hot, drop it like it's hot
When the pigs try to get at you
Park it like it's hot, park it like it's hot, park it like it's hot
And if a nigga get a attitude
Pop it like it's hot, pop it like it's hot, pop it like it's hot
I got the Rolly on my arm, and I'm pourin' Chandon
And I roll the best weed, ‘cause I got it goin' on

[Outro]
Snooooooooooop
Snooooooooooop"
3672,U Should've Known Better,Monica,Monica,U Should've Known Better Monica,"[Verse 1]
I didn't ask to go with you to Mexico
I really didn't need the shopping spree in LA or Melrose
Boy, if you didn't know it, well, now you know
I didn't need the furs or the jewelry
Because material things, it don't mean much to me
And ever since you've been gone
I've been holding us down, on my own and no, ...

[Pre-Chorus]
I never ever cheated, I never ever lied
So you can stop askin', askin' me why
Why I never left you
And why I kept it real
And why I'm still with you

[Chorus]
You should've known better
Than to think I would leave
You should've known better
Than to doubt me (me)
It don't matter if you're up
Matter if you're down
Either way, I'm gonna be around
You should've known that
I would stay by your side
Should've known your girl
Was gonna ride or die
And it just don't matter
If you're rich or poor, out or in doin' 5 to 10
You should've known better

[Verse 2]
What makes you think
That I would forget about ya?
Think about it, who comes to see ya?
Every Saturday and Monday I was on that receiver
It's me (me) your girl (girl), your life (life), your world (world)
My family and friends, they just don't understand
They say, I should leave you alone
But I say, that they all should just leave us alone
Don't you get it?

[Pre-Chorus]
I never ever cheated, I never ever lied
So you can stop askin', askin' me why
Why I never left you
And why I kept it real
And why I'm still with you

[Chorus]
You should've known better
Than to think I would leave
You should've known better
(Don't you doubt me) Than to doubt me
It don't matter if you're up
Matter if you're down
Either way, I'm gonna be around
You should've known that
I would stay by your side
Should've known your girl
Was gonna ride or die
And it just don't matter (don't matter to me, babe)
If you're rich or poor, out or in doin' 5 to 10
You should've known better

[Instrumental breakdown]

[Chorus]
You should've known better
Than to think I would leave
You should've known better
Than to doubt me
It don't matter if you're up
Matter if you're down
Either way, I'm gonna be around
You should've known that
I would stay by your side
Should've known your girl
Was gonna ride or die
And it just don't matter
If you're rich or poor, out or in doin' 5 to 10
You should've known better"
